郭台銘：中國部分產線遷高雄專訪談鴻海「和韓國瑜說好了」,【財經中心╱台北報導】鴻海董事長郭台銘接受《天下》雜誌專訪時首度透露，已經和高雄市長韓國瑜說好了，鴻海將把深圳、天津部分產線移到高雄，而且「不是把老的東西搬回來，是把新的科技搬進來。」台灣未來可望成為鴻海高階網通設備、伺服器的製造中心，專供中國以外市場。郭台銘接受《天下》專訪，談參選總統的初心，他表示意識到台灣面臨兩大危機，第一大危機是戰爭與和平的危機，如果台灣照現有的意識形態走下去，會有戰爭的危機；第二是美中貿易戰爭的危機。這兩個問題一個是實體的戰爭，一個是貿易的戰爭，兩強博弈的過程中，台灣絕對無法置身事外。郭台銘分析，最近中美貿易戰，很多台商回流投資台灣，這是平庸式的回流，從經濟學上叫比較利益，但如果他當上總統，「我已經不是一個公司董事長，而是台灣的總統，就是台灣科技島的董事長，我自己的企業不來捧場，那怎麼行？我要做個示範，大家一起來做。」郭台銘說，最近1個月內他就會下高雄決定設廠用地，「我上一次找韓市長，就是讓他去看那個地，看完就要決定蓋廠。」郭指出，包括天津1個工廠，與深圳一部分工廠，專供外銷的可能都會搬回來，內銷中國的則不會搬。「有些因中美貿易戰不能夠在中國生產的，像伺服器、網通設備等高階產品，就在台灣生產。」郭台銘說，未來高雄廠蓋好了，產品就外銷美、日，在中國以外的市場，以此為基地，作為鴻海各種雲端網路設備、伺服器等高端產品製造中心。郭台銘強調，高雄廠是高附加價值的供應鏈移轉，是做垂直整合產業鏈，不像現在一些台商回流是平庸式的回流，從經濟學比較利益的角度出發，考量「今天我回來，有沒有比較好、比較便宜？」微驅科技總經理吳金榮認為，郭台銘將中國部分產線遷回高雄是一石多鳥，不僅能避掉貿易戰影響，還有回台加碼投資的象徵意義。至於特別選在高雄落腳，吳金榮，政治意味明顯，近來韓國瑜積極爭取自經區，假設自經區開放外籍勞工申請條件，讓台灣勞工能擔任管理階級，就能吸引北漂回流，對於台灣有實質幫助。師大政研所教授曲兆祥表示，郭台銘的回流有經濟和政治意義。從經濟面來看，受美中貿易戰爆發，受影響最大的就是製造業，郭董的富士康屬於製造業，將深圳和天津從中國搬回台灣有其經濟面考量；至於政治面，當郭董在中國減少了雞蛋，就會想辦法把雞蛋放在台灣和美國等其他地方，這一來是回應了當初他投資高雄的承諾，另一方面也是可以減少外界對他親中的攻擊。,2019/5/9
談宗教「台灣屬中華民族」郭嗆陳明通曲解是打手,鴻海董事長郭台銘美國行，在私人專機上與媒體談及台灣和中國的關係，引發陸委會主委陳明通呼籲，「請郭董不要在國際社會傳達錯誤訊息」，郭台銘昨在臉書痛批陳是打手，根本不適任，還內行人說外行話，讓人很搖頭。陸委會昨晚回嗆，郭台銘論述方式已遭各界議論，陳明通是就兩岸關係表達政府立場，並強調這是絕對必要的政策宣示。《蘋果》還原郭台銘當時講話時空，是郭帶著媒體坐專機，將媽祖迎到威斯康辛州的工廠。郭說，「從神明來看，我們100%同意台灣是中國不可切割的一部分；但它是中華民族，應該這樣講，中華民族底下有兩個（神明）……這兩個神尊，可以讓我證明中華民族是……我要講一下就是說，既然大家都是來自中華民族，我認為應該給中華民國一些國際生存的空間。」郭的談話被《TaipeiTimes》翻成英文「TaiwanisaninseparablepartofChinaandbelongstotheChinesenation.」解讀成「台灣是中國不可分割的一部分，台灣屬於中國」。陳明通昨早說：「請郭董不要在國際社會傳達錯誤訊息。」郭台銘在臉書反擊，陳扭曲他的發言，「都當到中華民國行政院的大陸委員會主任委員了，還故意內行人說外行話，真的讓人很搖頭。」郭台銘說，他談到的是宗教信仰文化影響地區的概念，卻被特定媒體斷章取義扣紅帽子。郭澄清，他指的「中國」依照《憲法》就是中華民國，請陳不要配合假新聞傳播錯誤訊息。記者楊喻斐、黃韋銓,2019/5/7
中國憑什麼綁架我郭台銘：若以鴻海關廠威脅給我時間搬走,【楊喻斐、黃韋銓╱台北報導】決定角逐總統大位的鴻海董事長郭台銘，自上周和美國總統川普會面後，遭到外界質疑，昨他舉行記者會說明，明確表示不會有習郭會，但如果他當中華民國總統，會要求對岸平等尊嚴談判，如果中國不願意，並以鴻海關廠威脅，「給我幾個月的時間，我一定會搬到更有競爭力的地方」，「中國當局憑什麼綁架我」。郭台銘強調，鴻海工業互聯網模式已成形，可在全球任一地方控制、生產，製造業總部可能到美國，高科技總部在日本，而先前和高雄市長韓國瑜簽約，就是把集團雲端網路的中控放高雄軟園，強調經濟不受中國大陸要脅：「這是我當總統一定要做到的事。」郭台銘在上周和川普會面之後，支持和反對聲浪都突增，甚至民進黨總統參選人賴清德也批評郭台銘像是選特首，「有什麼資格選總統？」對於外界批評，郭台銘昨上午臨時通知下午開記者會，除向國人報告美國行成果外，更一一回應近日外界對他的質疑。對於媒體詢問，川郭會之後會不會和中國國家主席習近平見面，郭台銘昨首度明確表示，不會有習郭會。他說，連中聯辦他都不會去了，怎麼敢去習郭會。他還反問媒體：「你嫌我被染紅得不夠嗎？」但郭強調，日後會透過平台與中國溝通。郭台銘說，這次他在美國邀請陸、港媒體搭專機，他曾經當面問過陸、港媒體，會不會把他的帽子（上頭有國旗）打馬賽克，在場媒體都說不會，但事後還是打了馬，他相信不是高層的旨意。郭台銘說，「他打我馬，我也不是中華民國總統，不會有習郭會。」郭台銘更用「兩腿論」比喻台灣政治、經濟情勢，他說現在的社會應該有兩條腿，一條是政治腿，一條是經濟腿，台灣的政治腿經過30年改革開放，自由民主成果是領先的，但經濟是落後的，尤其新經濟的部分，必須要有人幫忙跨越。這次到美國白宮見川普，被媒體指遭白宮打臉，郭台銘語帶憤怒，他說美國本來就不會介入台灣大選，他與川普的私交並不是建立在選舉上，不管選舉前或選舉後，他都有直接的管道可以跟川普溝通。郭說，從前有川蔡通話，現在當然也可以有川郭會。郭台銘說他現在身上什麼顏色都有，他去美國被抹黑，說見川普是騙人、威州投資生變，但他還是順利進了白宮；去到威州，新任州長也去機場接他。後來又抹紅他，拿著鴻海在中國的投資質疑他會被對岸綁架，郭說，「我已經講不只一次了，鴻海的投資是實體產業」，創造實體製造業和就業機會的經濟活動，「中國當局憑什麼綁架我，要抹紅也請搞清楚現實。」郭台銘表示，這一生走的都是逆境，最喜歡挑戰與競爭，政壇如商場，一有成就，就會有人眼紅，有人想出拐子，但他無所畏懼，「這輩子都在走逆境，沒有逆境，我還會不習慣！」對郭台銘昨明確表示沒有習郭會，師大政研所教授曲兆祥表示，台灣特殊政治環境底下，若被扣紅帽子是很危險的事，郭等於表明不願意再被染紅。曲說，如果郭昨天說，他就是要見習近平，只有他能和中國如何如何，這頂帽子一定會越戴越紅，甚至變血紅色，就不用選總統了，在台灣政治生態中，「可以親美，但不能親中，最多只能友中。」從財經面來看，曲兆祥認為，郭台銘的企業是全球布局，前段時間都是壓寶中國，至於誰需要誰更多？郭需要中國，但中國可能更需要郭。淡江大學公行系教授陳銘祥解讀，郭台銘當然知道選總統，需要過半的選票，所以希望吸引各類選民，所以慢慢修正他的兩岸立場。陳銘祥表示，萬一郭當上總統，習近平當然不會見他，萬一郭沒選上，他要見習也沒人可管，不見習近平不代表跟中國撇清關係，「若要傾中，也不見得需要見習近平」，所以這是一句空話、話術。★台灣政經情勢．台灣社會應該有兩條腿，一條政治腿，一條經濟腿；政治腿經過30年改革是領先的，經濟是落後的★是否有習郭會．中聯辦都不去了，怎敢去習郭會★和川普見面被質疑．川蔡可以通話，川郭當然可以見面★被抹黑抹紅．我無所畏懼，這輩子都在走逆境，沒逆境我還會不習慣★在大陸投資恐被綁架．大陸當局憑什麼綁架我？如果威脅關廠，給我幾個月時間，我一定搬到更有競爭力的地方★誰會接班．10日董事會，誰在名單裡，誰就有機會當董事長資料來源：《蘋果》採訪整理,2019/5/7
郭采潔走出喪親慟復工劈3男劫3.6億,【張力文╱台北報導】33歲的郭采潔近年演藝事業轉往中國，3月她在臉書透露奶奶去世，讓跟奶奶關係親近的她感傷不已。她近來打起精神投入工作，上月出席北京電影節，接著又在上海、成都超級草莓音樂節演出，而她主演的都會愛情電影《我的第一任》周旋3男，1日在中國上映，截至昨3日票房已破7854萬元人民幣（約3億6400萬元台幣），拼出好成績。郭采潔和奶奶感情好，平時有空檔就會回木柵老家看奶奶，也會帶奶奶出國，奶奶過世對她打擊不小。她3月在臉書感傷寫下：「江湖再見，昨日擁抱，今日睡去。辛苦了，這2年的時間，妳比我們任何1個都勇敢。」悼別摯愛的奶奶。她最近平復心情、專注工作，上月22日為電影《記憶切割》亮麗出席北京電影節，上周在上海超級草莓音樂節獻唱，接著又轉往成都草莓音樂節，近期也參與江蘇衛視節目《最強大腦》並擔任隊長，相當活耀。《我的第一任》（中國片名：《下一任：前任》）改編小說《時間。差》，由兩性作家H（本名陳鴻儀）執導，郭采潔在片中周旋在鄭愷、李東學、寇家瑞3男之間，上演揭穿鄭愷已婚身分的怒賞巴掌戲。《蘋果》昨聯繫郭采潔經紀人問她近況和未來工作計劃，對方未接手機、簡訊未回。《我》片集結藍心湄、陳博正、林美秀，謝依霖、邰智源、王彩樺、任容萱、劉心悠等卡司，17日在台上映。,2019/5/4
「郭董另有要務」吳郭會延期2天,【綜合報導】國民黨總統初選制度尚未定案，黨中央原定本周六安排黨主席吳敦義與鴻海集團董事長郭台銘進行「吳郭會」，但因為郭董另有要務，國民黨昨宣布「吳郭會」將延後至13日舉行，至於15日要提報中常會的總統提名特別辦法，目前時程暫時不變。國民黨中常會通過4位中常委提案後，便將主、被動參選人納入初選民調，吳敦義也隨即與各參選人會面，先後與韓國瑜、王金平、朱立倫、周錫瑋等人會面，接下來還有孫文學校總校長張亞中以及郭台銘要跟吳敦義會面。鴻海董事長郭台銘昨晚po臉書，指前天記者會他現場秀跨腿示範「雙腿論」，由於腿實在太軟Q，被網友笑稱要開國術館，郭董澄清：「誤會了！」立法院前院長王金平昨從廈門赴漳州前往王氏家廟祭祖，宗親們都舉布條熱鬧迎接，王金平強調祭祖尋根回原鄉不應受政治阻隔。不過，漳州市白礁村當地為安排王金平祭祖，沿路維安均嚴格控管，一般人均不得靠近。,2019/5/8
宣布參選後首赴美戴新版國旗帽現身郭董po白宮照暗示將見川普,【國際中心、財經中心╱綜合外電報導】鴻海董事長郭台銘周二飛赴美國，威斯康辛州州長爆料，郭台銘將再度進入白宮與川普會商，白宮也未予否認。儘管消息人士透露，此行是為討論鴻海威州投資事宜，但郭台銘宣布選總統後首度進白宮會川普，刻意展現人脈與國際影響力，為參選造勢意味濃厚。郭台銘美東時間周三零時左右抵達華府，才休息幾個小時，近中午就輕裝出現在白宮附近，穿著紅色夾克、卡其褲，戴著繡有中華民國國旗與美國國旗的粉紅色國旗帽，在白宮正前方拍照上傳臉書粉絲團，小編還開玩笑說：「最近是不是流行爆雷」，文末並模仿川普口吻加註主題標籤（hashtag）「#MakeTaiwanGreatAgain」。早先美聯社引述威州州長埃弗斯（TonyEvers）說法表示，郭台銘將前往白宮和美國總統川普見面。白宮方面則表示兩人並未在周二會面，但未排除在美東時間周三（1日）可能見面。路透引述消息人士報導指出，郭台銘赴白宮是為了與川普討論鴻海威州投資事宜。埃弗斯則透露，這場會議不會有威州官員陪同，不清楚兩人可能會談內容，並半開玩笑地表示，川郭也許會交換選戰秘訣，討論「如何贏得這場選戰。」《蘋果》記者周二詢問郭台銘是否要前往美國，當時仍在台北的郭先反問：「你怎麼知道？」接著證實近日的確要往東飛，但詳細行程無法透露，隨後表示要去趕飛機了。對於外媒披露郭台銘訪問白宮行程，鴻海發言人表示，不會評論董事長行程。外媒則引述鴻海聲明指出，鴻海定期與威州政府及聯邦政府往來，但以保有隱私為由未證實任何可能的會面安排。郭台銘曾承諾投資威州100億美元（約3090.5億元台幣），並創造1.3萬個工作機會，但埃弗斯憂心依目前進度，鴻海恐難實踐承諾，先前拋出考慮削減提供鴻海的投資獎勵優惠，要與鴻海重新談判。據威州拉辛郡地方報紙《TheJournalTimes》報導，鴻海4月26日公布威州6代面板廠最新一波徵才訊息，將再釋出30個工作機會，涵蓋基層員工至高階幹部，培訓內容則包括液晶顯示器技術、晶圓廠興建與營運。,2019/5/2
專家看郭韓像「歌劇院對歌仔戲」,馬英九文教基金會昨邀集有機會角逐2020年大位的3大巨頭參與圓桌論壇，各自表述經濟理念，萬寶投顧董事長朱成志分析鴻海董事長郭台銘、高雄市長韓國瑜的表現，有如「天龍配地虎」、「國家歌劇院對上本土歌仔戲」，雙方表現可圈可點，但就投資界眼光來看，郭台銘已點出未來經濟藍圖，他指出的每個方向，幾乎檔檔都是「明牌」。朱成志說，韓國瑜嚴格說並沒有提出明確政策，只有簡單的希望將政府機能轉為商業服務，韓的談吐舉例多、接地氣，可以想見會讓一般民眾「聽得很爽」，韓的策略或許可以讓政府效率提升，但沒辦法讓企業賺錢。反觀郭台銘，朱成志說，從早上的專題到下午的圓桌論壇，郭台銘點出幾個重點，包括美中貿易戰的壓力，中國一定會驚天動地開放，這時候中華民國的定位在哪裡，還有5G及AI兩大發展，都點出了未來經濟藍圖，可以讓台灣發展、翻轉經濟。其次郭台銘還提到一個重點，未來一旦美中貿易戰結束，美國還是會到中國設廠，但敏感性科技技術，預料不會到中國，這時距離中國一臂之遙的地方，就有機會得利，這個一臂之遙，指的就是台灣，所以未來貿易戰結束後，全球勢必投入科技戰，台灣若是2020不準備好，勢將被淘汰。財經中心,2019/5/1
圓桌會藍營3巨頭論戰經濟郭台銘聚焦青創韓國瑜暢談「發大財」朱立倫喊執行力,【楊喻斐╱台北報導】馬英九基金會昨舉辦研討會，藍營總統參選人幾乎全數到齊，鴻海董事長郭台銘用了18分鐘論述，採取「親韓打綠」策略，多次提及「韓市長」，砲火朝向民進黨政府。他在重頭戲圓桌論壇時聚焦青年創業，表態未來擬成立青年創業基金，幫助年輕人和國際上有實力的投資者接軌，讓台灣年輕人走入國際舞台。馬英九基金會昨舉辦「突破困境、迎接挑戰」重振台灣競爭力會議，昨邀請郭台銘演講，郭首度談到參選動機，指年輕人低薪、負債、無法學以致用，許多人看到他們的憤怒，他卻看到年輕人的絕望與沮喪。郭台銘以「美中貿易戰對未來台灣經濟的機遇和挑戰」為題發表演說，指未來科技發展沒有G20，只有G2，就是美中各自定標，未來世界將是「Oneworld、Twosystems（一個世界、兩套系統）」，呼籲台灣只要掌握機會，就能達到「台灣獲利、美國達標、中國轉型成功」三贏境界。下午圓桌論壇時，郭台銘表示，鴻海集團內部透過所謂的三創「創意、創新、創業」鼓勵員工創業，他並請到兩位在鴻海集團內部創業成功的「肚肚」Henry孫和翊和「H.Spectrum」Saxon陳俊嘉現身說法，這兩個人當初都是把自己的身家押下去，獲得郭台銘支援而創業成功。郭台銘強調，所有總統參選人都要疼惜年輕人，未來他希望可以成立一個青年創業基金，爭取真正有實力的創業投資者，像是軟銀的孫正義。他說現在很多人在網路上攻擊他，但他不怕，內心充滿拯救台灣年輕人的使命感。郭台銘說，對於台灣而言，最大的市場是美國，其次是中國，要如何建立關係，外交與經濟得互相結合。郭借用成吉思汗的話：「如果當一群老虎被一個綿羊所帶領，那這一群老虎也變成綿羊。」如果是綿羊的總統，大家也都會變成綿羊。郭說，「我是老鼠拖出來的老虎，但我不願意被現在的綿羊政府帶領。」郭台銘稱韓講義氣，接地氣，是個好市長，「我常說政治要為經濟服務，韓國瑜做到了！」論壇結束後，郭台銘隨即啟程赴美，是否會再與美國總統川普會面，或與威州州長艾佛斯見面，相關人士則不願透露。未來科技發展沒有G20，只有G2，由美中各自定標貿易戰台灣要掌握機會，達到「台灣獲利、美國達標、中國轉型成功」三贏境界成立青年創業基金，和國際有實力投資者接軌台灣不需要每個地方蓋蚊子館，錢應做有效運用我是老鼠拖出來的老虎，但我不願被現在的綿羊的政府帶領資料來源：《蘋果》採訪整理【黃韋銓╱台北報導】高雄市長韓國瑜昨出席馬英九基金會舉辦的「突破困境、迎接挑戰」重振台灣競爭力會議，在圓桌論壇中，韓國瑜持續暢言「貨出得去，人進得來，高雄發大財」的夜市觀光庶民經濟，強調政府不應該讓所有企業有後顧之憂，經濟要翻轉，政府部門要先翻轉，經濟才有可能成長。不過議論稍嫌不夠具體。「貨出得去，人進得來，高雄發大財」，韓國瑜昨在圓桌論壇再次搬出讓他翻身的選舉金句。韓國瑜表示，這句話沒什麼高深經濟理論，當初他到了高雄農業縣，看到農產品賣不出去，跑去跟夜市攤販聊天，發現觀光客進不來，這城市要怎麼救？他自己觀察後就想到一句話，東西要賣出去，人要進得來，高雄才能發大財，這道理不是很難懂。韓國瑜舉例，什麼是愛情？就是費盡千辛萬苦最後希望洞房花燭夜，什麼叫選舉？就是票多的贏、票少的輸，什麼叫賺錢？就是東西賣出去，人賺大錢，他體會到升斗小民要求不高，就是安身立命，在工作之中多勞多得，沒想到造成這麼大迴響。「我們就是政治整椎師」，要從政治先改革。韓國瑜表示，過去學而優則仕，唯有讀書高，慢慢就有官本位心態，所以政府不應該高高在上，政府改革是非常迫切的。韓說，思路一通就全部都通，政府不應讓所有企業家有後顧之憂，也不應認為手上有權，就覺得自己簡直不得了，台灣經濟要翻轉，政府部門認知要先翻轉，經濟才有可能成長。圓桌會議進行到提問階段，對於媒體人陳文茜提問，如何落實AI跟雙語教學？韓國瑜回應他最擔憂的就是教育問題，他的家鄉雲林20年前推動雙語教育，當年沒人想到有人會在雲林推雙語中小學，但下一代沒有中英文雙母語，第一回合就被KO，一點機會都沒有，讓他非常擔憂。至於統獨議題，韓國瑜說，統獨講那麼多年，民進黨掌握行政院、立法院，也不敢獨，其實台灣只剩兩種人，第一種是過得好，根本不管中國大陸；第二種是希望台灣人過得更好，大陸人也很好，兩邊都過得好，如果是第一種可能比較傾向獨派，第二種可能中間傾向「合」，這是從心理分析。政府改革迫切，過去學而優則仕，唯有讀書高，政府不應該高高在上公務員要理解我們就是「政治整椎師」，思路一通就全部都通，認知要先改變台灣經濟要翻轉，政府不應讓企業家有後顧之憂統獨講那麼多年，民進黨掌握行政院、立法院，也不敢獨台灣未來不能再搭圍牆，才能拼經濟。內心世界要打開，才會處處有機會資料來源：《蘋果》採訪整理【黃韋銓╱台北報導】新北市前市長朱立倫昨參加重振台灣競爭力會議圓桌論壇時強調，台灣的經濟特點是「吃硬不吃軟」，靠硬體發展，但未來要軟硬兼施，發展新創、文化、生活經濟。對於鴻海董事長郭台銘主張「為年輕人創造機會、拼科技和AI產業最重要」，朱則認為，不但要給年輕人機會，老中青各世代也要有未來，「不要拼成富民經濟，而是全民經濟、庶民經濟。」昨天論壇現場依筆畫順序發言，最先發言的是朱立倫，他自嘲說，安排他先發言，「因為我是唯一沒有工作的人。」隨即話鋒一轉，批評總統蔡英文領導國家沒方向，沒有「leadership（領導力）」。朱強調，要成為總統，最重要的是執行力，這是每個人都期待的，還要有協調力，把不同意見整合在一起、把大家團結起來，更要有強烈的企圖心、包容和同理心，才能領導國家。由於郭台銘上午演講時提到「大家都說要拼經濟，但涵蓋面不夠，目前要拼的是科技和AI」，朱立倫提出不同看法。朱說，他在政府服務多年，拼經濟不能只看科技、新創經濟，而要拼全民經濟。「政府拼經濟，不要拼成富民經濟，而是全民經濟、庶民經濟」，經濟發展的成果一定要讓全部民眾都感受到，「這才是我們要拼的經濟」。朱指出未來AI不可能取代人，但會成為重要助手，政府必須創造更多機會。朱立倫也認為，要給年輕人發展機會很重要，但應不分老中青少、銀髮族等，大家都有機會、都能獲利，不是只給年輕人未來。未來台灣的經濟發展要軟硬兼施，除了在新創經濟、AI、大數據、資安、電競等扮演重要角色，培養軟體科技人才，結合宗教民俗觀光的文化經濟，以及包含食衣住行娛樂的文化經濟，也都能創造出產業的價值和就業機會。最後朱立倫把矛頭轉回民進黨，批民進黨現在競選連任，一定會說以後要如何改革，所以必須連任，但「施重肥，不如換新株」，台灣要重新站起來、重新出發，換掉民進黨政府，才能走出台灣未來的明天。朱也強調，「與神同行，不如與民同行」，經濟發展要讓全民受用，民進黨都用減法經濟，但應該要用加法經濟，政府必須加強對人的照顧，不要忘記以民為本。總統最重要的是要有執行力、協調力，整合不同意見，以及強烈企圖心，中華民國要更強郭台銘說科技和AI是重點，但拼經濟不能只看科技，拼經濟不要拼成富民經濟，而是拼全民經濟、庶民經濟，士農工商都能分享經濟發展成果雖然要給年輕人一個未來，但不分老中青少、銀髮族，大家都要有機會、都能獲利台灣有很多隱形冠軍，把台灣當基地，到世界各地生產，呼籲台商回來，創造更多就業機會資料來源：《蘋果》採訪整理,2019/5/1
