蔡諷郭「去講給中國聽」「哪國人都不應用武力破壞和平」,【林維崧、何哲欣╱台北報導】鴻海集團董事長郭台銘對於政府軍購發表「不該為了買而買」、「中國人不打中國人」說法，總統蔡英文昨嗆說，中國國家主席習近平從未放棄過對台動武，相信「郭台銘這些話比較適合講給中國聽」。至於香港13萬人遊行抗議反對修改《逃犯條例》，蔡也回應說，暴露出「一國兩制」並非香港人最喜歡的方案，也再次證明，一國兩制或一國一制都不是台灣的選項。郭台銘日前提出「國防靠和平」說法，認為軍購的錢要花在刀口上，不該為了買而買，並解釋沒有一個家庭願把子女送上戰場，強調國防要靠和平，要實力，以和平為後盾「我們不挑釁，不懼怕，我不講不懼戰，為什麼中國人要打中國人？」言論一出立即激出藍綠火花。總統蔡英文昨出席「美超微電腦（Supermicro）公司」亞太科技園區第二期新建工程動土典禮，對於鴻海郭董指稱「中國人不打中國人」，蔡英文強調，郭台銘董事長也會同意，不論是哪一國的人，都不應該用武力來破壞和平。蔡英文說，台灣一直都是這個區域和平、穩定的貢獻者，相信「郭台銘這些話比較適合講給中國聽」。蔡英文指，2016年後，我們強調國防自主，無論在研發或製造上，包括國艦國造、國機國造，都是國防自主裡很重要的部分，自行製造如有不足，才會對外尋求軍購。即便是軍購，也是自衛性的防衛。香港民眾13萬人前天遊行抗議反對修改《逃犯條例》及台灣人民前往參加卻遭到遣返，蔡英文對此表示，我國國民到不同的國家去，受到的待遇，也是我們要入境的那個國家所採取態度的一種表現，這些事情一再發生，暴露出「一國兩制」對於香港人來說，都不是他們最喜歡、也最可以接受的方案。這也再次證明了，一國兩制或一國一制都不是台灣的選項。針對蔡英文和賴清德昨天的回嗆，郭台銘昨晚在臉書po文，指稱「我們，都是中華民國國家隊的一員！」認為蔡政府號稱維持現狀，卻不斷向台灣人渲染大陸威脅，彷彿戰亂將至。到底是中國大陸真的準備以武促統了呢？還是蔡政府連任出現危機，而在避重就輕、操作政治呢？郭台銘質疑蔡總統和賴前院長讓兩岸只剩下互相猜忌，虛耗台灣國力。難道把台灣推向戰爭邊緣，就是你們贏得勝選的手段嗎？難道去年選舉結果還不夠明顯？請蔡總統不要再把心思都花在選舉上，黨內互打不夠，還鬥到外面來了！郭自稱以宣示和平態度，「中國人不打中國人，不只是講給自己人聽的，同時講給中國大陸聽、講給習近平聽、講給川普聽、也是講給全世界聽！這是對全世界的宣示。」1/09強力反擊「習五點」，被支持者稱「辣台妹」，蔡英文強調「我們都是辣台派，該辣就辣」3/19合體網紅蔡阿嘎拍影片搞笑4/23到三立電視台的本土劇《炮仔聲》片場探班4/24參加網紅節目《博恩夜夜秀》，展現輕鬆一面資料來源：《蘋果》採訪整理,2019/4/30
「選下去」郭董6/21交棒鴻海競選總部將成立股民喊：開始處分股票,【楊喻斐、陳俐妏╱台北報導】「不要只想著結果，既然決定了就選下去！」鴻海董事長郭台銘展現如成吉思汗征戰沙場鋼鐵般的意志，參加國民黨內總統初選，沒有回頭選項。據郭身邊幕僚透露，競選總部不但近期就會成立，也會在6月21日的股東會上宣布交棒。股務承辦單位福邦證券透露，今年出席人數估將衝到萬人以上，以往有如郭董粉絲見面會的股東會，恐畫休止符。郭台銘近日以國民黨總統初選參選人的身分出席各種活動，展開了一連串的「跑攤」行程，首先就從半導體科技重鎮新竹開始，緊接著再下台中，目的就是希望接地氣，吸引更多人氣，成為國民黨最強的總統候選人。雖然郭董屢次透露，誠心希望國民黨能夠整合，但他也展現當仁不讓決心。據知情人士表示，郭董是選真的，競選總部不但近期就會成立、由他親自對外宣布之外，就是令人質疑他無法與鴻海集團切割之處，也會在6月21日舉行的股東會上作一了斷，正式交出董事長一職。知情人士說，鴻海今年股東會後的董事會將會推舉新董事長，屆時郭將不再擁有鴻海董事長身分，並同步退出董事會，宣示參選的決心。據了解，儘管最近國民黨內鬥傳言不斷，且綠營炮火猛烈，但郭董卻告訴助選團隊：「不要只想著結果，既然決定了就選下去。」福邦證券透露，這次鴻海股東會將創下有史以來最多股東出席人數，恐會把會場擠得水洩不通，初估人數將超過上萬人，但這也可能是郭台銘最後一次以董事長身分出席股東會，未來郭董與股東粉絲見面的情景恐不復見。對於郭董交棒，被視為最懂鴻海的前外資分析師楊應超認為，其實郭幾年前就開始做交棒準備，包括將各次集團分出，但要郭董通過初選，未來鴻海交棒才會有更明確動作。楊應超說，如果郭要找一個懂鴻海、自己人，依循美國總統川普和女兒伊凡卡模式，他推測接班呼聲最高的就是號稱鴻海「錢媽媽」的總財務長黃秋蓮。楊應超說，川普辭去公司職務後，由女兒伊凡卡接手；鴻海目前營運步上軌道，交棒後不用擔心次集團董事長不會聽新任董事長決策，因為重大決策還是會經過郭台銘之手。對於郭台銘將於6月交棒，已經引發財經界震撼。投資20年、目前手中有數百張鴻海股票的David王表示，郭董這樣很不負責任，他在請辭之前，必須向股東交代清楚。他說，自投資鴻海迄今，逢低就加碼，就是看到鴻海的未來與成長性，還有郭董的個人領導風格，但是現在鴻海的股票跌破100元，未實現他先前的承諾，「就要去選總統，實在很不負責。」另名投資人張先生說，若郭董真的要選總統，他就要開始處分手中的鴻海集團持股。對於手中有多少鴻家軍股票，張先生說連他太太都不知道，但是光鴻海一檔不會低於200張。,2019/4/30
鴻海沒了郭董「決策效率恐變差」,鴻海董事長郭台銘將於6月股東會上交棒，引發外界關注是否將對鴻海經營造成影響。產業專家認為，其實企業的經營和換不換領導人並非正相關，但鴻海沒有了郭台銘，影響最大的恐怕是鴻海內部的決策效率。自創辦人張忠謀去年退休之後，台積電就屢屢出狀況，接連發生生產線中毒大當機資安疑慮、上萬片晶圓報廢事件。而更早之前台塑創辦人王永慶交棒後，3個月內工廠也發生大火，出現工安管理問題。如今郭台銘要辭董座選總統，鴻海集團將面對何種交棒風險引發關注。華南投顧董事長儲祥生表示，從過去經驗來看，企業交棒之後，公司發生狀況就容易聯想是領導換人螺絲鬆了，但其實這不一定真的與換領導人有關，因為一般領導人是不會管到太細微的小事，且就算領導人在工廠也是有可能會出狀況，因此鴻海交棒，估計影響最大的還是在決策效率。儲祥生進一步指出，鴻海未來可能會走向集體管理，但在沒有郭董的領導下，決策效率多少會受到影響。但這不一定是不好，就像專政體制效率佳，但也可能做錯決策，結果如何仍未可知。研調機構微驅科技總經理吳金榮認為，郭台銘在鴻海最重要的角色就是拍板定案，鴻海集團各部門獨立，加上各公司有大將在，比如呂芳銘負責亞太電信、池育陽負責富智康，而郭台銘就是最後拿定主意的人。吳金榮說，未來鴻海集團可能會走向集體領導，但在拍板定案上就會需要有能力的人出頭擔任決策者。記者林彤潔,2019/4/30
趙少康傳真：韓郭之爭（趙少康）,從韓國瑜的五點聲明看到，「他想選總統，但他不能主動參加初選。」原本外界以為韓國瑜不想選總統，而又沒有其他藍營候選人可以獲勝，只好「犧牲」得來不容易的高雄市長，換取更重要的總統一職，唯一之策就是「勉為其難」的強迫徵召韓國瑜，如今既然另有也可以勝選的郭台銘，加上韓國瑜也表明他想選總統，而且大家都看得出他想選總統，那就大大方方參加初選，有何困難？又何必徵召？韓國瑜、柯文哲之所以受到很多人的支持，就因為他們比傳統的政治人物看來「真」，想說就說，就算說得不得體大家也不計較，他們一旦「失真」，就失去他們吸引群眾的特色及價值，韓國瑜既然想選，就直說我想參選、我要參選，「想要又不說想要」，不合現代民主社會的風格，參選本來就是每個公民的權利，選不選得上交由選民決定，高雄市長做不久去參選總統適不適合的判斷，並非用是否國民黨主動、被動徵召就可以解決的，而是要選民做綜合評量經過投票的集體決定。至於高雄市議會6月5日才結束總質詢，所以之前韓國瑜不能表態，實屬無稽之談，韓國瑜不說，民進黨議員就不問了嗎？真要問有一百種方法可以問。潘琣偵○╞x銘如果事先打電話給韓國瑜就好了，假定郭台銘先打電話，韓國瑜要怎麼回應？「謝謝你打電話告訴我你要選，你真夠意思，我本來也要選的，因為你打電話給我，所以我決定不選了，讓你選就好。」你覺得有可能嗎？郭台銘如果事先打電話給韓國瑜，固然禮數是到了，反而讓韓國瑜為難，不如兄弟登山，各自努力，誰也不欠誰的情。民調一翻兩瞪眼，2012年蔡英文民調只多蘇貞昌一個百分點，去年台中市盧秀燕只多江啟臣0.6個百分點，如果到時候韓國瑜只小贏郭台銘，輸贏在誤差範圍之內，但就必須提名韓國瑜，結果本來郭台銘可贏總統，韓國瑜可鎮守高雄，可能變成韓國瑜當選總統，陳其邁奪回高雄。既然是全民調，韓郭朱王等人就必須提出政策主張拼搏，最好有幾場政策辯論，讓大家看看這幾位候選人到底要如何引領台灣向前行？也等於是大選的暖身，如果什麼都不舉辦，就這麼無聲無息的做三個民調，憑印象就決定了總統候選人，不是太草率了些？吳敦義主席要認真考慮：（1）誰能選得贏民進黨？（2）如果韓國瑜當選總統，高雄市長誰來選？（3）誰能做一個好總統？就算選贏了，做不好的話，就像蔡英文一樣，很快就會被選民拋棄。國民黨如果很快就被選民下架，要再翻身可就難了。電視廣播主持人,2019/4/26
郭董選總統鴻海後續表現也不會太差,【林巧雁╱台北報導】鴻海董事長郭台銘日前宣布將參選總統後，公司股價一度大漲，外資法人也紛紛看好投入，看得其他投資人很心動，但未來是否可繼續追？法人認為，鴻海股價提前發酵，未來股價是否還有空間往上或可能拉回？還是要回歸基本面來看。鴻海上次低點為3月29日的71.9元，4月中旬過後因郭董參選熱聞，股價上漲約3成，一度衝破90元。國泰證期顧問處經理蔡明翰認為，鴻海之前股價走強，主要原因是財報公布優於預期，先前法人對於鴻海的看法過度保守，所以4月才大漲，今年第1季鴻海股價幾乎沒有動，呈現持平，之後展開落後補漲，且4月漲勢也包含內外資大量買超。蔡明翰也看好鴻海後市表現，因財報數據優於預期，另外大立光、台積電法說看法從保守轉正向，對鴻海也有正向助益，建議投資人可等鴻海股價拉回再介入，法人投資鴻海的成本估計約在80~85元之間。除看股價之外，蔡明翰也建議量縮是進場買點，第2波大漲時鴻海曾爆量16萬張，如果等到量縮到5萬~6萬張時可進場。外資對於鴻海獲利展望看法差不多，預估今年EPS(每股純益)賺8~9元之間，不過各家對於鴻海股價預測卻是差距頗大，從80~120元都有。有美系外資在郭董宣布參選總統後調降評價，認為少了郭董對鴻海是減分，恐會影響公司的專注與投入，但也有外資認為，郭董底下的鴻家軍無弱將，對於接班沒有那麼悲觀。兆豐投顧指出，鴻海股價在金融海嘯後幾次高點分別為2017年6月30日的122.5元，2010年4月的154.5元、2010年1月的155.5元，若台股持續漲勢，美股也走強，鴻海後續表現也不會太差。,2019/4/26
郭自爆曾馨瑩離家出走好友：她只是去透氣,自鴻海董事長郭台銘宣布參選，傳出妻子曾馨瑩離家出走，《蘋果》昨致電曾，本人並未接電話，但其好友表示，曾因為心疼老公在選戰中遭抹黑，心情沉重，只是出去透透氣。鴻海董事長郭台銘昨天接受TVBS的專訪，自爆跳出來參加國民黨總統初選，引發太太曾馨瑩抱怨並離家出走，雖說兩人已經一星期沒有見面，但他認為「軍國大事，後宮不要干政」。郭台銘決定角逐2020年總統大位，彷彿投下震撼彈，最受影響的是他的枕邊人曾馨瑩。她2008年嫁給郭董，育有郭曉如、郭曉嬡及郭守善。嫁入首富家庭11年，她稱自己不擅言詞，從害怕媒體變成落落大方，卻始終像當年愛跳舞的女孩。曾馨瑩日前接受《蘋果》訪問表示，嫁給郭董變成媒體焦點，初期很不自在，出席公開活動多以微笑代替發言，或頂多吐出「謝謝」兩字便快閃，她剖析自己懼怕麥克風，從小怕說話，連上說話課都會緊張到哭，因此學了跳舞，以肢體語言表達。曾馨瑩即使被冠上首富夫人這個稱謂，她從不認為她是名人，曾因壓力大到灑淚，畢竟自由對她太重要，她說過「我不想被塑造成名媛，但我還是我」。由於郭董宣布參加國民黨總統初選，稱是媽祖託夢，但昨天他在接受電視台專訪時表示「後宮不要干政」，一番話引發社會學學者、社會民主黨召集人范雲不滿，她在粉專發文：「要選的時候說是女人（媽祖）叫你選」、「現在又叫女人別干政？」綜合報導,2019/4/26
郭台銘戰隊成形A咖操盤專家讚策略有層次「霸氣的虎轉變成狐」,郭董整軍【財經中心╱台北報導】郭董玩真的！鴻海董事長郭台銘競選團隊就定位，據《蘋果》獨家消息，郭台銘上周五與資深媒體人趙少康、國民黨副主席郝龍斌、理律法律事務所資深合夥人陳長文等人相聚，郭向在座人士請益選舉操盤及財產轉移事項。消息人士指出，郭這次操盤手將找來A級團隊操刀，選戰的檔次將不同於其他候選人。在宣布完參加國民黨總統黨內初選後，郭台銘隨即出國處理要務，但據可靠消息指出，郭董近日已回台灣，且對選舉是有備而來。尤其周二高雄市長韓國瑜發表「不滿權貴密室協商」5點聲明後，郭立即在下午發聲明回應，先是對韓說法表示肯定，且文章四平八穩、鏗鏘有力，不僅反應機智，且緊扣議題，讓郭董氣勢在這一回合強過韓流。郭台銘上周五特別撥時間與資深媒體人趙少康等人吃飯，郭已進入備戰狀態，消息來源說，他這次要打的是不同檔次的選戰，將找A級團隊、最棒的律師，操刀選戰及資產規劃，都讓全球有目共睹，也透過這次的選戰，能讓台灣被全球看見，檔次不同於其他候選人。《蘋果》致電趙少康，未獲回應。據了解，近期已有不少人向郭台銘推薦適合的操盤手，包括資深媒體人董智森、唐湘龍，甚至綠營前大老沈富雄等戰將級人物，目前雖未公布競選團隊成員，但可以知道的是這個團隊已成立，以郭的手筆，能被選中的人一定為「強中之強」。《蘋果》昨致電董、唐、沈，皆未獲得回應。另外，有人擔心郭台銘親和力不夠，不像韓國瑜會講笑話，甚至還有人認為他是霸氣總裁，嫌他「腰不夠軟」，不過據郭身邊幕僚指出，郭做起生意來，腰要多軟就能有多軟，客戶原要求1周交貨，改成3天交貨都可以，「郭董只要把面對客戶的身段拿來面對選民，一切都不成問題。」由於郭台銘是大數據的忠實信徒，包括母親初永真的健康數據，以及未來女婿的挑選，都要靠大數據，業界人士也推估，未來郭台銘勢必用大數據為他推出的政策把關。資深媒體人黃創夏昨表示，郭的競選策略相當有層次，先是透過送國旗帽塑造其正藍形象；其次利用《台美關係法》40周年紀念活動怒飆民進黨立委蕭美琴，修理對手陣營；昨天再接受電視台專訪，展現柔軟一面。過去是霸氣的虎，競選之後，狐的特色也逐步顯露。萬寶投顧董事長朱成志說，先前韓國瑜在訪美時，曾以「國防靠美國，科技靠日本，市場靠大陸，努力靠自己」20字箴言形容台灣的處境，不過郭台銘卻說：「國防靠和平，市場靠競爭，技術靠研發，命運靠自己。」同樣20個字，感受2人的差異，郭董有高度，韓市長接地氣，兩位人氣都旺，但格局差很大。．贈送國旗帽，引發認同選民熱情。．展現高度，對國民黨中央、韓國瑜團隊不出惡言。．堅持初選，展現對民主信仰及自信。．強勢反擊，在民主vs.吃飯議題上與總統蔡英文對戰不退讓。．超級競選團隊成形，為強中之強。資料來源：《蘋果》採訪整理,2019/4/26
郭台銘能如願打「和平經濟」牌？（林正二）,剛宣布參加國民黨初選的郭台銘，立刻受到韓國瑜暗示可接受國民黨徵召的挑戰。但韓市長沒有國際事務經驗，不像郭董因事業遍及全球，且跟中美兩國領袖交情匪淺，頗多民眾期待他能提振台灣經濟，並在美中台之間求取平衡點，建構兩岸和平關係。這是郭董比韓市長強的地方。但郭董可以如願順利地打「和平經濟」牌嗎？首先就「和平」牌來說，縱使習近平已言明，「九二共識」就是「一中原則、一國兩制」統台，但郭董與藍營仍自欺欺人地以「九二共識、一中各表」為兩岸策略。其原因應是藍營評估國人認為中國統台是很久以後的事，以為國民黨的「九二共識」仍可建構兩岸和平緩衝空間，護衛中華民國；同時藍營亦可配合中國打台獨的策略，醜化民進黨維護中華民國台灣主權是台獨，已將兩岸帶往戰爭方向。蔡總統執政後，並沒有往法理台獨方向邁進，挑釁中國，還不斷呼籲中共，兩岸應以對等地位建構和平穩定的關係。但中國近年已展開一中統台工作，除了以經濟利誘外，不時以戰機軍艦繞台威嚇台灣，鑒於西藏跟中國簽訂「和平協議」沒多久，中共即派兵入侵西藏、大肆殘殺藏胞的往例，台灣要如何藉由一廂情願的以「九二共識」、「和平協議」維護和平？郭董所說的「國防要靠和平」根本就是顛倒了，以色列強敵環伺，不靠強大的國防維護和平，要靠什麼？此外，中國近年在南海與東海擴增軍力，美國為維持西太平洋國際權力結構的平衡，不斷加強美日同盟的功能，防衛範圍擴增到台灣，將台灣納入抗衡中國的印太戰略體系中。在美國領導民主國家抗衡中國的新國際情勢中，中國將不斷運用「溫水煮青蛙」策略，加強併吞中華民國的工作，郭董可以因為親中，怕得罪中共當局，而特意忽略中共的統台意圖，將台灣排除於民主國家的聯盟防衛體系外？郭董的傾中跟美國的全球抗中戰略是矛盾的，在「美國優先」的策略下，川普怎可能因為跟郭董的私人交情而繼續維持台美緊密關係，支持台灣抗中？郭董有能耐在美中抗衡的國際情勢中，兩邊都討好嗎？可以只靠破功、沒有「一中各表」的「九二共識」，護衛中華民國嗎？經濟方面，郭董如要發展人工智能等新經濟產業，他親中遠美的戰略，可以讓美國放心協助台灣發展新經濟嗎？在中國積極推動「一國兩制台灣方案」統台時，郭董可以將台灣的經濟發展鎖在中國單一市場？值此台商因美中貿易大戰、中國經濟受創慘重，紛紛返台投資之際，郭董如推動台灣資訊與傳統產業的生產重心移往大陸，台灣產業結構完整性將遭到破壞、技術外流，並引發中低階層勞工結構性失業，惡化所得分配不均問題；國內經濟對中國依賴程度將更深，增強中國以經濟制裁強迫我國接受政治要求之力量，讓台灣走向被「一國兩制」統一之路。郭董有豐富的國際經貿經驗，跟中美日領袖有交情，但有龐大的事業在中國，在親中遠美的心態下，很難在全球抗衡中國的新國際情勢中找到台灣的國際定位，讓台灣經濟與美日等國經濟體緊密結合，並藉由印太戰略護衛台灣的和平，而且因為太傾中，最後只能走向被中國統一之路。比郭董沒有國際事務經驗的韓市長，如果只會嘴巴喊愛中華民國，卻仍緊抱著已破功、只有「一中」無「各表」的「九二共識」，沒有其他可突破「一中」架構的兩岸外交戰略，中華民國台灣也會漸融入中國的「一國兩制台灣方案」路途中。退休駐美外交人員,2019/4/24
被罵卡韓郭董背黑鍋有感表態後遭韓粉灌爆臉書黨卻未再聯繫,2020大選風雲大咖回應【綜合報導】自4月16日宣布動念選總統後，鴻海董事長郭台銘的心境猶如洗三溫暖，從火速接受國民黨頒發入黨50年榮譽狀後，網友的謾罵、「卡韓」的批評排山倒海而來，讓這位身家逾2千億元的全台首富，體會人情冷暖。據消息人士指出，自郭宣布參加國民黨初選後，國民黨就未有人和他接觸，讓郭有「背黑鍋」感慨，甚至傳出他參選的態度已出現變化。但當昨高雄市長韓國瑜發表5點聲明，2個小時後、人在國外的郭台銘在臉書貼文，除認同韓的「政治權貴熱中密室協商」之說，更大器推崇韓，甚至主動向國民黨中央喊話，可在初選制度上開大門、走大路，甚至可將韓的意願納入考量，為他打造方便參加初選的規則。郭台銘強調，「只有中華民國的勝利，才有國民黨的勝利」，「國民黨黨內的民主初選，是要讓選民對比目前胡作非為的民進黨，看看他們的面貌。」郭台銘說，他希望所有黨內同志，都能進到民主初選制度中進行公平且良性的競爭，最後無論是誰出線，只要是公平、公正、公開民主程序產生，都能團結全黨重回執政。儘管早知道韓國瑜將針對總統大選發表聲明，據消息人士指出，郭董並未放在心上，早先已飛到國外去處理要務。但該名消息人士也說，從國民黨近期的態度，讓郭董難免心裡有背黑鍋的感慨。原因是郭從宣布參加國民黨初選後，除遭到部分偏綠網友攻擊外，也有不少韓粉灌爆他臉書，認為郭拋出只願初選不願接受徵召的說法，意在「卡韓」。此外國民黨在郭董宣布參加初選後，就未再與他有任何聯繫，讓外界替郭抱屈，認為他被陷害，甚至還傳出郭董對參選的態度已出現一些變化。對此國民黨中央表示，相關會面、討論都在安排中，沒有冷落誰的問題。消息人士透露，原本郭董對於國民黨總統初選就未放在心上，也沒有出太多力氣去準備，之所以拋出只願初選、不願徵召的議題，是為了建立制度，所以迄今連初選的操盤手都沒找，一切順其自然，也樂見韓出來進行公平的競爭。該人士強調，如果初選結果由韓勝出，郭董也會全力支持，共同努力替國民黨打贏總統大選；反之，若由郭董勝出代表國民黨與民進黨競爭，最後則交由選民決定。消息人士透露，郭董若代表國民黨出征2020且贏得大選，他勢必要退出鴻海集團；若在大選中敗陣，他則會回歸鴻海，但會逐漸退居二線，將鴻海交棒給其他專業經理人。4/16證實動念選總統4/17國民黨頒發榮譽狀給郭，郭宣布參加國民黨總統初選，不接受徵召4/19國民黨主席吳敦義表示將徵召高雄市長韓國瑜參加初選，郭回應，樂見優秀同志參加初選4/20總統蔡英文引用網友話批郭「沒有民主只能要飯吃」，郭反擊並舉辦網路投票4/21郭和蔡針對「民主vs.吃飯」空中交火4/23韓國瑜發表5點聲明，郭認同韓所說「政治權貴熱中密室協商」，強調會走完國民黨黨內初選資料來源：《蘋果》採訪整理,2019/4/24
